{
 "artifact": "kycar-snapshot-baseline",
 "artifactVersion": "1.0.0",
 "schemaVersion": "1.0.0",
 "snapshotId": "be-20260921T060000Z",
 "profile": "test",
 "producedBy": {
  "name": "kycar-baseline",
  "version": "1.0.0",
  "providerVersion": "P3-1.0.0"
 },
 "producedFrom": {
  "sha256": "a7d893657ea7e4f4bb9748748e02baeae067080fa79a66999f23d5a10ac9cf9b",
  "listingCount": 20000
 },
 "selectionCount": 19986,
 "ingest": {
  "lineCount": 20000,
  "listingCount": 19986,
  "rejectedCount": 0,
  "rejectedByReason": {},
  "duplicateListingCount": 14,
  "duplicateValueConflictCount": 0,
  "unknownCountByField": {
   "priceEvaluationCategory": 4576,
   "netPriceEur": 15681,
   "vatRatePercent": 15680,
   "msrpEur": 17455,
   "modelId": 240,
   "wasCabOrRental": 15799,
   "hasParticleFilter": 15055,
   "fuelTypesAdditional": 19378,
   "batteryOwnership": 19484,
   "batteryCapacityKwh": 17267,
   "isPluginHybrid": 17726,
   "co2EmissionsGPerKm": 3274,
   "consumptionElectricKwh100Km": 17931,
   "co2Class": 11949,
   "electricRangeKm": 16931,
   "sealCodes": 16996,
   "co2Source": 19986,
   "consumptionSource": 19986,
   "vatDeductible": 7700,
   "publicationState": 2945,
   "previousOwnerCount": 7778,
   "hasFullServiceHistory": 6788,
   "isMetallic": 5437,
   "gearCount": 6439,
   "consumptionCombinedL100Km": 4466,
   "euEmissionStandard": 4420,
   "efficiencyClass": 15442,
   "upholsteryColor": 8390,
   "upholsteryType": 5848,
   "paintType": 16491,
   "badgeDisplacementL": 1643,
   "cylinderCapacityCcm": 2693,
   "cylinderCount": 6039,
   "modelYear": 1197,
   "drivetrain": 2526,
   "fuelSourceLabelRaw": 1505,
   "equipmentCodes": 590,
   "regionCode": 174,
   "postalCodePrefix2": 84,
   "hadAccident": 4951,
   "seatCount": 1853,
   "modelVersionRaw": 725,
   "modelVersionClean": 805,
   "trimTokens": 805,
   "doorCount": 802,
   "bodyColor": 644,
   "fuelTypePrimary": 664,
   "transmission": 309,
   "powerKw": 564,
   "powerHp": 564,
   "firstRegistrationYearMonth": 308,
   "vehicleAgeMonths": 308,
   "mileagePerYearKm": 805,
   "priceEur": 724,
   "mileageKm": 451,
   "offerType": 217,
   "bodyType": 167,
   "usageState": 196,
   "fuelCategory": 26
  },
  "ingestFlagCounts": {
   "MODEL_UNRESOLVED": 240,
   "REGION_UNRESOLVED": 164,
   "UNIT_UNSUPPORTED": 90,
   "PRICE_MISSING_UNDECLARED": 120,
   "PRICE_SENTINEL_ABSOLUTE": 19,
   "VERSION_FULLY_STRIPPED": 80,
   "POWER_UNIT_MISMATCH": 12,
   "SUSPECT_ZERO_MILEAGE": 50,
   "PRICE_ON_REQUEST_WITH_AMOUNT": 8,
   "FIRST_REG_OUT_OF_RANGE": 16,
   "MILEAGE_OUT_OF_RANGE": 8,
   "PRICE_OUT_OF_RANGE": 4
  },
  "noticeCounts": {
   "HYBRID_INCONSISTENT": 16,
   "CO2_ZERO_NON_BEV": 24,
   "MILEAGE_IMPLAUSIBLE_FOR_AGE": 60,
   "HYBRID_CATEGORY_UNRESOLVED": 16
  },
  "measurementCounts": {
   "WLTP": 8177,
   "NEDC": 5604,
   "UNKNOWN": 6205
  }
 },
 "rows": [
  {
   "makeId": 74,
   "listingCount": 2197,
   "price": {
    "min": 500,
    "max": 370572,
    "p05": 2475,
    "p50": 13990,
    "p95": 47990,
    "n": 2129
   },
   "mileage": {
    "min": 12700,
    "max": 1450000,
    "p05": 35100,
    "p50": 99500,
    "p95": 313100,
    "n": 2133
   },
   "year": {
    "min": 1991,
    "max": 2025,
    "p05": 2008,
    "p50": 2019,
    "p95": 2023,
    "n": 2075
   },
   "sampleCoverage": 1,
   "modelCount": 54
  },
  {
   "makeId": 13,
   "listingCount": 1680,
   "price": {
    "min": 1046,
    "max": 309642,
    "p05": 3990,
    "p50": 20990,
    "p95": 64174,
    "n": 1586
   },
   "mileage": {
    "min": 7200,
    "max": 1450000,
    "p05": 34000,
    "p50": 100200,
    "p95": 334400,
    "n": 1649
   },
   "year": {
    "min": 1986,
    "max": 2025,
    "p05": 2008,
    "p50": 2019,
    "p95": 2023,
    "n": 1580
   },
   "sampleCoverage": 1,
   "modelCount": 67
  },
  {
   "makeId": 47,
   "listingCount": 1519,
   "price": {
    "min": 790,
    "max": 471991,
    "p05": 3990,
    "p50": 23500,
    "p95": 64950,
    "n": 1470
   },
   "mileage": {
    "min": 14000,
    "max": 1450000,
    "p05": 34100,
    "p50": 103800,
    "p95": 317600,
    "n": 1479
   },
   "year": {
    "min": 1989,
    "max": 2025,
    "p05": 2008,
    "p50": 2019,
    "p95": 2023,
    "n": 1440
   },
   "sampleCoverage": 1,
   "modelCount": 105
  },
  {
   "makeId": 55,
   "listingCount": 1440,
   "price": {
    "min": 463,
    "max": 396948,
    "p05": 2397,
    "p50": 13950,
    "p95": 35990,
    "n": 1387
   },
   "mileage": {
    "min": 8600,
    "max": 1196100,
    "p05": 36600,
    "p50": 104500,
    "p95": 319800,
    "n": 1408
   },
   "year": {
    "min": 1987,
    "max": 2025,
    "p05": 2008,
    "p50": 2019,
    "p95": 2023,
    "n": 1355
   },
   "sampleCoverage": 1,
   "modelCount": 46
  },
  {
   "makeId": 54,
   "listingCount": 1377,
   "price": {
    "min": 390,
    "max": 441476,
    "p05": 1990,
    "p50": 12990,
    "p95": 39990,
    "n": 1327
   },
   "mileage": {
    "min": 11500,
    "max": 1450000,
    "p05": 32600,
    "p50": 98100,
    "p95": 297000,
    "n": 1339
   },
   "year": {
    "min": 1987,
    "max": 2025,
    "p05": 2009,
    "p50": 2019,
    "p95": 2023,
    "n": 1286
   },
   "sampleCoverage": 1,
   "modelCount": 40
  },
  {
   "makeId": 9,
   "listingCount": 1239,
   "price": {
    "min": 1050,
    "max": 2555453,
    "p05": 4000,
    "p50": 22990,
    "p95": 65453,
    "n": 1186
   },
   "mileage": {
    "min": 7300,
    "max": 1450000,
    "p05": 33700,
    "p50": 97700,
    "p95": 323000,
    "n": 1215
   },
   "year": {
    "min": 1988,
    "max": 2026,
    "p05": 2007,
    "p50": 2019,
    "p95": 2023,
    "n": 1177
   },
   "sampleCoverage": 1,
   "modelCount": 42
  },
  {
   "makeId": 60,
   "listingCount": 1119,
   "price": {
    "min": 550,
    "max": 448510,
    "p05": 1990,
    "p50": 14900,
    "p95": 54713,
    "n": 1084
   },
   "mileage": {
    "min": 10500,
    "max": 1450000,
    "p05": 37200,
    "p50": 98800,
    "p95": 332400,
    "n": 1084
   },
   "year": {
    "min": 1987,
    "max": 2025,
    "p05": 2007,
    "p50": 2019,
    "p95": 2023,
    "n": 1044
   },
   "sampleCoverage": 1,
   "modelCount": 39
  },
  {
   "makeId": 21,
   "listingCount": 860,
   "price": {
    "min": 790,
    "max": 135500,
    "p05": 1990,
    "p50": 11990,
    "p95": 38500,
    "n": 833
   },
   "mileage": {
    "min": 12000,
    "max": 1439400,
    "p05": 35000,
    "p50": 103100,
    "p95": 319800,
    "n": 837
   },
   "year": {
    "min": 1991,
    "max": 2025,
    "p05": 2007,
    "p50": 2019,
    "p95": 2023,
    "n": 795
   },
   "sampleCoverage": 1,
   "modelCount": 43
  },
  {
   "makeId": 29,
   "listingCount": 839,
   "price": {
    "min": 650,
    "max": 327791,
    "p05": 2950,
    "p50": 16000,
    "p95": 48900,
    "n": 811
   },
   "mileage": {
    "min": 7700,
    "max": 1450000,
    "p05": 32100,
    "p50": 102900,
    "p95": 345900,
    "n": 817
   },
   "year": {
    "min": 1994,
    "max": 2025,
    "p05": 2009,
    "p50": 2019,
    "p95": 2023,
    "n": 789
   },
   "sampleCoverage": 1,
   "modelCount": 43
  },
  {
   "makeId": 70,
   "listingCount": 800,
   "price": {
    "min": 490,
    "max": 379570,
    "p05": 2000,
    "p50": 14900,
    "p95": 50990,
    "n": 770
   },
   "mileage": {
    "min": 14100,
    "max": 1450000,
    "p05": 35100,
    "p50": 100100,
    "p95": 310200,
    "n": 782
   },
   "year": {
    "min": 1989,
    "max": 2025,
    "p05": 2008,
    "p50": 2019,
    "p95": 2023,
    "n": 766
   },
   "sampleCoverage": 1,
   "modelCount": 50
  },
  {
   "makeId": 65,
   "listingCount": 700,
   "price": {
    "min": 890,
    "max": 69990,
    "p05": 2216,
    "p50": 16000,
    "p95": 46500,
    "n": 673
   },
   "mileage": {
    "min": 13800,
    "max": 1450000,
    "p05": 36400,
    "p50": 105500,
    "p95": 341900,
    "n": 682
   },
   "year": {
    "min": 1987,
    "max": 2025,
    "p05": 2007,
    "p50": 2019,
    "p95": 2023,
    "n": 651
   },
   "sampleCoverage": 1,
   "modelCount": 24
  },
  {
   "makeId": 33,
   "listingCount": 520,
   "price": {
    "min": 436,
    "max": 92950,
    "p05": 1950,
    "p50": 12950,
    "p95": 51950,
    "n": 505
   },
   "mileage": {
    "min": 12300,
    "max": 420000,
    "p05": 31100,
    "p50": 100600,
    "p95": 323700,
    "n": 516
   },
   "year": {
    "min": 1991,
    "max": 2025,
    "p05": 2007,
    "p50": 2019,
    "p95": 2023,
    "n": 494
   },
   "sampleCoverage": 1,
   "modelCount": 34
  },
  {
   "makeId": 39,
   "listingCount": 477,
   "price": {
    "min": 1000,
    "max": 90900,
    "p05": 2398,
    "p50": 11990,
    "p95": 32990,
    "n": 464
   },
   "mileage": {
    "min": 13800,
    "max": 420400,
    "p05": 32500,
    "p50": 97800,
    "p95": 289500,
    "n": 459
   },
   "year": {
    "min": 1994,
    "max": 2025,
    "p05": 2010,
    "p50": 2019,
    "p95": 2023,
    "n": 443
   },
   "sampleCoverage": 1,
   "modelCount": 37
  },
  {
   "makeId": 73,
   "listingCount": 460,
   "price": {
    "min": 1400,
    "max": 262573,
    "p05": 4900,
    "p50": 23950,
    "p95": 55950,
    "n": 440
   },
   "mileage": {
    "min": 13800,
    "max": 420000,
    "p05": 39200,
    "p50": 105800,
    "p95": 305200,
    "n": 448
   },
   "year": {
    "min": 1990,
    "max": 2025,
    "p05": 2007,
    "p50": 2018,
    "p95": 2023,
    "n": 427
   },
   "sampleCoverage": 1,
   "modelCount": 32
  },
  {
   "makeId": 52,
   "listingCount": 400,
   "price": {
    "min": 750,
    "max": 455351,
    "p05": 2990,
    "p50": 18000,
    "p95": 50990,
    "n": 382
   },
   "mileage": {
    "min": 18700,
    "max": 1450000,
    "p05": 34300,
    "p50": 95400,
    "p95": 294000,
    "n": 390
   },
   "year": {
    "min": 1991,
    "max": 2025,
    "p05": 2008,
    "p50": 2019,
    "p95": 2023,
    "n": 373
   },
   "sampleCoverage": 1,
   "modelCount": 34
  },
  {
   "makeId": 28,
   "listingCount": 380,
   "price": {
    "min": 500,
    "max": 288500,
    "p05": 1300,
    "p50": 8990,
    "p95": 36462,
    "n": 369
   },
   "mileage": {
    "min": 18600,
    "max": 420000,